{
  "schema_version": "0.9.0",
  "publication_id": "0000-example-synthetic-prbs-worked-example",
  "title": "SYNTHETIC EXAMPLE -- not a real manuscript",
  "authors": [
    "Example, A."
  ],
  "status": "drafting",
  "artifacts": [
    {
      "ref": "prbs-co-ox-synthetic-001",
      "kind": "dataset",
      "role": "underlying_data",
      "locator": "Figure 1",
      "notes": "The PRBS trace itself."
    },
    {
      "ref": "SYNTH-CATALYST-001",
      "kind": "sample",
      "role": "supporting",
      "notes": "Catalyst the trace was measured on."
    },
    {
      "ref": "model-lh-two-site-synthetic-2026-09-01-fa1957",
      "kind": "model",
      "role": "model",
      "locator": "Figure 2"
    },
    {
      "ref": "tcat-tool-standard",
      "kind": "external",
      "role": "software",
      "notes": "Analysis code; a release DOI would go in `software` below."
    }
  ],
  "data_availability_statement": "SYNTHETIC. Drafted here rather than written from memory at submission, so that what it promises can be checked against what is actually registered.",
  "software": [
    {
      "name": "tcat-tool-standard",
      "repository": "https://github.com/TransientCatalysis/tcat-tool-standard",
      "version": "0.1.0",
      "license": "MIT"
    }
  ],
  "trace_ai_checklist": {
    "checklist_version": "2.2.0",
    "gaps": [
      "Sections B and C are not substantiable for a synthetic example."
    ]
  },
  "funding": [
    {
      "funder": "US Department of Energy",
      "award": "DE-FOA-0003612",
      "program": "Genesis Mission"
    }
  ],
  "project": "genesis-prbs-phase-1",
  "notes": "Generated by examples/make_examples.py. Not a real manuscript."
}
